{
  "fixture": {
    "isDesignFixture": true,
    "label": "DESIGN FIXTURE · 운영 분석 결과 아님",
    "case": "부분 근거 · bounded 상태"
  },
  "report": {
    "templateId": "fcc-kc-a-executive-editorial",
    "templateVersion": "0.1.0",
    "reportNo": "DEMO-FCC-2026-0001",
    "title": "무선 모듈 인증 동향과 시험기관 편중",
    "subtitle": "2026년 상반기 FCC/KC 공개 인증 데이터 분석 · 하반기 시험 물량 배분 결정용",
    "purpose": "executive",
    "issuedAt": "2026.08.31",
    "publisher": "주식회사 에이치시티",
    "product": "Blue Report FCC/KC Insight",
    "audience": "경영진 · 영업 책임자",
    "preparedFor": "2026 하반기 사업계획 회의"
  },
  "scope": {
    "sourceDataVersion": "FCC-PUBLIC-2026.08.15 / KC-PUBLIC-2026.08.12",
    "sourceWatermark": "public-snapshot-20260815",
    "appliedPeriod": "2026-01-01 ~ 2026-08-15",
    "periodIsPartial": true,
    "partialPeriodNote": "2026년 8월은 15일까지만 반영된 부분 기간 — 전월과 같은 자로 견주지 않음",
    "appliedFilters": [
      "제품군 = 무선 모듈(WLAN · BLE)",
      "인증분류 = FCC Part 15C / KC 적합성평가",
      "제외 = 시험 취하 · 반려 건"
    ],
    "populationDefinition": "기간 내 공개된 인증 건 중 필터를 통과한 전체",
    "recordGrain": "certification",
    "coverageComplete": "bounded",
    "recordsCoverageComplete": false,
    "coverageNote": "근거 일부만 반환 — 상한 4건 · 전체 1,284건"
  },
  "entityResolution": {
    "resolvedName": "대상 제조사 12개사",
    "aliases": [
      "법인명 변경 2건",
      "영문 표기 상이 5건"
    ],
    "unresolvedCount": 3,
    "ambiguousCount": 1,
    "method": "사업자 식별자 우선 · 실패 시 정규화 상호 + 주소 대조"
  },
  "metrics": [
    {
      "id": "cert_total",
      "label": "기간 내 인증 건수",
      "value": 1284,
      "unit": "건",
      "note": "고유 인증 식별자 기준"
    },
    {
      "id": "entity_total",
      "label": "제조사 수",
      "value": 12,
      "unit": "개사",
      "note": "엔터티 해소 후"
    },
    {
      "id": "lab_share_top",
      "label": "1위 시험기관 비중",
      "value": 41.2,
      "unit": "%",
      "note": "1,284건 중 529건",
      "state": "warn"
    },
    {
      "id": "yoy_delta",
      "label": "전년 동기 대비",
      "value": "+18.4",
      "unit": "%",
      "note": "2025-01-01~08-15 대비"
    }
  ],
  "charts": [
    {
      "id": "trend_monthly",
      "kind": "time_series",
      "title": "월별 인증 건수",
      "unit": "건",
      "axisNote": "8월은 15일까지의 부분 기간",
      "partialFromIndex": 7,
      "series": [
        {
          "name": "인증 건수",
          "points": [
            {
              "label": "1월",
              "value": 152
            },
            {
              "label": "2월",
              "value": 138
            },
            {
              "label": "3월",
              "value": 171
            },
            {
              "label": "4월",
              "value": 165
            },
            {
              "label": "5월",
              "value": 183
            },
            {
              "label": "6월",
              "value": 196
            },
            {
              "label": "7월",
              "value": 209
            },
            {
              "label": "8월",
              "value": 70
            }
          ]
        }
      ]
    },
    {
      "id": "lab_rank",
      "kind": "ranked_bar",
      "title": "시험기관별 처리 건수",
      "unit": "건",
      "axisNote": "모집단 1,284건 · 상위 6개 기관",
      "series": [
        {
          "name": "처리 건수",
          "points": [
            {
              "label": "시험기관 A",
              "value": 529,
              "emphasis": "subject"
            },
            {
              "label": "시험기관 B",
              "value": 241,
              "emphasis": "context"
            },
            {
              "label": "시험기관 C",
              "value": 188,
              "emphasis": "context"
            },
            {
              "label": "시험기관 D",
              "value": 142,
              "emphasis": "context"
            },
            {
              "label": "시험기관 E",
              "value": 106,
              "emphasis": "context"
            },
            {
              "label": "그 외 7개 기관 합계",
              "value": 78,
              "emphasis": "context"
            }
          ]
        }
      ]
    }
  ],
  "narrative": [
    {
      "origin": "server_fact",
      "title": "검증된 사실",
      "paragraphs": [
        "기간 내 인증 1,284건 중 529건(41.2%)이 단일 시험기관에서 처리",
        "상위 3개 기관이 958건(74.6%) 차지 · 나머지 9개 기관이 326건 분점"
      ]
    },
    {
      "origin": "ai_interpretation",
      "title": "해석 — 검증된 사실 아님",
      "paragraphs": [
        "특정 기관 편중은 일정 지연 위험과 직결 가능 — 다만 이 데이터는 처리 건수만 담고 있어 처리 기간·대기열 확인 불가",
        "편중의 원인이 기관 역량인지 제조사 관행인지는 이 데이터로 판별 불가"
      ]
    },
    {
      "origin": "human_note",
      "title": "검토자 메모",
      "paragraphs": [
        "영업본부 확인 필요 — 시험기관 A 의 4분기 예약 가능 여부"
      ]
    }
  ],
  "recommendations": [
    {
      "text": "시험기관 A 편중 완화 — 하반기 물량 중 <b>30%를 B·C로 분산</b> 검토",
      "owner": "영업본부",
      "due": "9월 2주"
    },
    {
      "text": "처리 기간 데이터 확보 — 공개 데이터에 없는 항목이므로 <b>기관 직접 문의</b>",
      "owner": "AX추진팀",
      "due": "9월 3주"
    },
    {
      "text": "미해소 엔터티 3건 정리 후 재집계 — 수치가 소폭 바뀔 수 있음",
      "owner": "AX추진팀",
      "due": "10월 1주"
    }
  ],
  "quality": {
    "summary": [
      {
        "label": "반환 행",
        "value": 1284,
        "note": "필터 통과 전체"
      },
      {
        "label": "고유 인증",
        "value": 1284,
        "note": "중복 없음"
      },
      {
        "label": "미해소 엔터티",
        "value": 3,
        "note": "상호 표기만 확인"
      }
    ],
    "warnings": [
      "근거는 상한까지만 반환 — 목록이 전체가 아님",
      "2026년 8월은 15일까지의 부분 기간 — 월 추이의 마지막 점을 전월과 같은 자로 견주지 않음",
      "미해소 엔터티 3건은 제조사 수(12개사)에 미포함"
    ],
    "limitations": [
      "공개 인증 데이터는 시장점유율·매출·수주를 뜻하지 않음",
      "처리 기간과 대기열은 공개 데이터에 없음",
      "인증 취소·만료 이력은 이번 모집단에 미포함"
    ]
  },
  "evidence": {
    "state": "bounded",
    "returned": 4,
    "total": 1284,
    "items": [
      {
        "certificationId": "2AXXX-WM100-2026",
        "sourceRef": "FCC OET Authorization Search · 2026-08-15",
        "entity": "제조사 가",
        "grantedAt": "2026-07-18",
        "state": "bounded"
      },
      {
        "certificationId": "MSIP-CRM-XYZ-WM200",
        "sourceRef": "국립전파연구원 적합성평가 공고 · 2026-08-12",
        "entity": "제조사 나",
        "grantedAt": "2026-07-02",
        "state": "bounded"
      },
      {
        "certificationId": "2BYYY-BLE55-2026-REV2",
        "sourceRef": "FCC OET Authorization Search · 2026-08-15",
        "entity": "주식회사 매우긴법인명테스트용제조사",
        "grantedAt": "2026-06-27",
        "state": "bounded"
      },
      {
        "certificationId": "R-C-ZZZ-WLAN-2026-0091",
        "sourceRef": "국립전파연구원 적합성평가 공고 · 2026-08-12",
        "entity": "제조사 라",
        "grantedAt": "2026-05-14",
        "state": "bounded"
      }
    ]
  },
  "publicContacts": [
    {
      "entity": "시험기관 A",
      "channel": "website",
      "value": "공개 누리집에 게시된 대표 문의 창구",
      "source": "기관 공개 누리집",
      "verifiedAt": "2026-08-20"
    }
  ],
  "lineage": {
    "snapshotChecksum": "sha256:3f9a1c… (fixture)",
    "reportModelChecksum": "sha256:7b22e0… (fixture)",
    "consistencyProjectionChecksum": "sha256:c14d88… (fixture)",
    "lineageChecksum": "sha256:9e0af5… (fixture)",
    "generatedBy": "Blue Report FCC/KC Insight · 보고서 모델 1.3.1 계약 기준"
  }
}
